"success","procedure","trial_type","trial_index","time_elapsed","internal_node_id","view_history","rt","trialid","stimulus","response"
"true","AIM","fullscreen","1","5728","0.0-1.0-0.0","","","","",""
"","AIM","instructions","2","9307","0.0-2.0","[{""page_index"":0,""viewing_time"":3575}]","3576","Instructions_01","",""
"","AIM","survey-multi-choice-vertical","3","11644","0.0-3.0","","2327","AIM_01","{""Q0"":""¿Cuál es el nivel educacional alcanzado (último año aprobado) por el principal sostenedor del hogar?""}","{""Q0"":"" Básica completa; primaria o preparatoria completa.""}"
"","AIM","survey-multi-choice-vertical","4","13391","0.0-4.0","","1741","AIM_02","{""Q0"":""¿Cuál de las siguientes ocupaciones corresponde al trabajo del principal sostenedor del hogar? [Si el principal sostenedor del hogar está cesante o es jubilado, debe ser la última ocupación remunerada que tuvo. Si el principal sostenedor tiene más de 1 trabajo, debe registrarse el de mayor ingreso.]""}","{""Q0"":"" Otros grupos no identificados (incluye rentistas, personas en situación de discapacidad, etc.)""}"
"","AIM","survey-text","5","14008","0.0-5.0","","608","AIM_03","{""Q0"":""Ahora, hablando de su hogar: Incluyéndose usted, ¿cuántas personas viven en su hogar en la actualidad? No considere el servicio doméstico, aunque sea puertas adentro.""}","{""Q0"":""56""}"
"","AIM","survey-multi-choice-vertical","6","15207","0.0-12.0-0.0","","1195","AIM_10","{""Q0"":""Por favor, piense en ingreso total de su hogar en un mes promedio, considerando el aporte de todos sus miembros y otros ingresos adicionales como rentas de propiedades, jubilaciones o pensiones. ¿en cuál de estos tramos está el ingreso total mensual de su hogar?""}","{""Q0"":"" 809 mil – 1.409.000 mil""}"
